<?xml version="1.0" encoding="UTF-8"?>
<personas xmlns:xsi="http://www.w3.org/2001/XMLSchema-instance" xsi:noNamespaceSchemaLocation="ejercicio_6.xsd">
    <persona fechaNacimiento="1992-07-15">
        <comentario>Estudiante de historia y apasionado por los viajes.</comentario>
        <formaPago>
            <tarjeta>
                <numeroTarjeta>1234567890123456</numeroTarjeta>
            </tarjeta>
        </formaPago>
        <datos>
            <nombre>Carlos</nombre>
            <apellidos>Rodríguez Sánchez</apellidos>
            <dni>23456789C</dni>
        </datos>
    </persona>

    <persona>
        <formaPago>
            <transferencia>
                <numeroCuenta>ES9121000418450200051332</numeroCuenta>
            </transferencia>
        </formaPago>
        <comentario>Profesora de matemáticas y aficionada a la astronomía.</comentario>
        <datos>
            <nombre>Lucía</nombre>
            <apellidos>Martínez Pérez</apellidos>
            <dni>98765432D</dni>
        </datos>
    </persona>
</personas>
